{
  "$schema": "https://json-schema.org/draft/2020-12/schema",
  "$id": "https://borek.ai/schemas/slide_spec/group_c/open_questions_01/v1.0",
  "title": "OpenQuestions01SlideSpec",
  "description": "MS-4: two-column content contract for the OPEN_QUESTIONS_01 Borek layout.",
  "type": "object",
  "additionalProperties": false,
  "allOf": [
    { "$ref": "../base.schema.json#/$defs/SlideSpecBase" }
  ],
  "properties": {
    "schema_version": { "$ref": "../base.schema.json#/properties/schema_version" },
    "slideId": { "$ref": "../base.schema.json#/properties/slideId" },
    "layoutId": { "const": "OPEN_QUESTIONS_01" },
    "sectionLabel": { "$ref": "../base.schema.json#/properties/sectionLabel" },
    "title": { "$ref": "../base.schema.json#/properties/title" },
    "subtitle": { "$ref": "../base.schema.json#/properties/subtitle" },
    "sourceChapterIds": { "$ref": "../base.schema.json#/properties/sourceChapterIds" },
    "left": { "$ref": "#/$defs/QuestionColumn" },
    "right": { "$ref": "#/$defs/QuestionColumn" }
  },
  "required": ["schema_version", "layoutId", "title", "sourceChapterIds", "left", "right"],
  "$defs": {
    "QuestionColumn": {
      "type": "object",
      "additionalProperties": false,
      "required": ["heading", "items"],
      "properties": {
        "heading": { "type": "string", "minLength": 1 },
        "items": {
          "type": "array",
          "items": { "type": "string", "minLength": 1 }
        }
      }
    }
  }
}
